{
  "$schema": "https://json-schema.org/draft/2020-12/schema",
  "$id": "candidate-set-v1.json",
  "title": "Lumi Trace deterministic candidate set v1",
  "type": "object",
  "additionalProperties": false,
  "required": [
    "schema_version",
    "algorithm",
    "finding_id",
    "index_id",
    "top_k",
    "candidate_count_considered",
    "candidates",
    "confidence_is_not_probability",
    "candidate_set_id"
  ],
  "properties": {
    "schema_version": {
      "const": "candidate-set-v1"
    },
    "algorithm": {
      "enum": [
        "deterministic-candidate-ranking-v1",
        "deterministic-candidate-ranking-v2",
        "role-aware-sparse-v0.4.1.3"
      ]
    },
    "candidate_algorithm": {
      "enum": [
        "label-blind-python-role-candidates-v0.4.1.5",
        "label-blind-python-role-candidates-v0.4.1.6",
        "label-blind-python-role-candidates-v0.4.1.7"
      ]
    },
    "ranking_id": {
      "type": "string",
      "pattern": "^ranking:[0-9a-f]{64}$"
    },
    "finding_id": {
      "type": "string",
      "minLength": 1,
      "pattern": "^[A-Za-z0-9._:-]+$"
    },
    "index_id": {
      "type": "string",
      "pattern": "^index:[0-9a-f]{64}$"
    },
    "top_k": {
      "type": "integer",
      "minimum": 1,
      "maximum": 1000
    },
    "candidate_count_considered": {
      "type": "integer",
      "minimum": 0
    },
    "candidates": {
      "type": "array",
      "items": {
        "$ref": "#/$defs/candidate"
      }
    },
    "confidence_is_not_probability": {
      "const": true
    },
    "confidence_descriptor": {
      "enum": [
        "ABSTAINED",
        "FINDING_GUIDED_SIGNAL_PRESENT"
      ]
    },
    "abstention": {
      "$ref": "#/$defs/abstention"
    },
    "candidate_set_id": {
      "type": "string",
      "pattern": "^candidate-set:[0-9a-f]{64}$"
    }
  },
  "allOf": [
    {
      "if": {
        "properties": {
          "algorithm": {
            "const": "role-aware-sparse-v0.4.1.3"
          }
        },
        "required": [
          "algorithm"
        ]
      },
      "then": {
        "required": [
          "candidate_algorithm",
          "ranking_id",
          "confidence_descriptor",
          "abstention"
        ],
        "properties": {
          "candidates": {
            "items": {
              "allOf": [
                {
                  "$ref": "#/$defs/candidate"
                },
                {
                  "required": [
                    "role"
                  ]
                }
              ]
            }
          }
        }
      },
      "else": {
        "not": {
          "anyOf": [
            {
              "required": [
                "candidate_algorithm"
              ]
            },
            {
              "required": [
                "ranking_id"
              ]
            },
            {
              "required": [
                "confidence_descriptor"
              ]
            },
            {
              "required": [
                "abstention"
              ]
            }
          ]
        }
      }
    },
    {
      "if": {
        "properties": {
          "candidate_algorithm": {
            "const": "label-blind-python-role-candidates-v0.4.1.7"
          }
        },
        "required": [
          "candidate_algorithm"
        ]
      },
      "then": {
        "properties": {
          "candidates": {
            "items": {
              "properties": {
                "path": {
                  "pattern": "^(?![\\s\\S]*[^\\u0020-\\u007e])[\\u0020-\\u007e]+$"
                },
                "symbol": {
                  "properties": {
                    "extractor": {
                      "const": "python-lexical-v1"
                    }
                  }
                }
              }
            }
          }
        }
      }
    },
    {
      "if": {
        "properties": {
          "candidate_algorithm": {
            "enum": [
              "label-blind-python-role-candidates-v0.4.1.5",
              "label-blind-python-role-candidates-v0.4.1.6"
            ]
          }
        },
        "required": [
          "candidate_algorithm"
        ]
      },
      "then": {
        "properties": {
          "candidates": {
            "items": {
              "properties": {
                "symbol": {
                  "properties": {
                    "extractor": {
                      "const": "python-ast-v1"
                    }
                  }
                }
              }
            }
          }
        }
      }
    }
  ],
  "$defs": {
    "abstention": {
      "type": "object",
      "additionalProperties": false,
      "required": [
        "abstained",
        "reason"
      ],
      "properties": {
        "abstained": {
          "type": "boolean"
        },
        "reason": {
          "oneOf": [
            {
              "type": "null"
            },
            {
              "const": "NO_POSITIVE_FINDING_GUIDED_SIGNAL"
            },
            {
              "const": "CANDIDATE_GENERATION_TRUNCATED"
            }
          ]
        }
      }
    },
    "relativePath": {
      "type": "string",
      "minLength": 1,
      "pattern": "^(?!/)(?![A-Za-z]:)(?!.*\\\\)(?!.*(?:^|/)\\.\\.(?:/|$))[^\\u0000]+$"
    },
    "region": {
      "type": "object",
      "additionalProperties": false,
      "required": [
        "start_line",
        "start_column",
        "end_line",
        "end_column"
      ],
      "properties": {
        "start_line": {
          "type": "integer",
          "minimum": 1
        },
        "start_column": {
          "type": "integer",
          "minimum": 1
        },
        "end_line": {
          "type": "integer",
          "minimum": 1
        },
        "end_column": {
          "type": "integer",
          "minimum": 1
        }
      }
    },
    "scoreReason": {
      "type": "object",
      "additionalProperties": false,
      "required": [
        "code",
        "points"
      ],
      "properties": {
        "code": {
          "type": "string",
          "pattern": "^[A-Z][A-Z0-9_]*$"
        },
        "points": {
          "type": "integer"
        },
        "matches": {
          "type": "array",
          "minItems": 1,
          "maxItems": 20,
          "uniqueItems": true,
          "items": {
            "type": "string",
            "minLength": 1
          }
        }
      }
    },
    "candidateSymbol": {
      "type": "object",
      "additionalProperties": false,
      "required": [
        "name",
        "qualified_name",
        "kind",
        "extractor"
      ],
      "properties": {
        "name": {
          "type": "string",
          "minLength": 1
        },
        "qualified_name": {
          "type": "string",
          "minLength": 1
        },
        "kind": {
          "type": "string",
          "minLength": 1
        },
        "extractor": {
          "enum": [
            "python-ast-v1",
            "python-lexical-v1",
            "lexical-v1"
          ]
        }
      }
    },
    "candidate": {
      "type": "object",
      "additionalProperties": false,
      "required": [
        "kind",
        "path",
        "region",
        "integer_score",
        "score_reasons",
        "candidate_id",
        "rank"
      ],
      "properties": {
        "kind": {
          "enum": [
            "file",
            "symbol"
          ]
        },
        "path": {
          "$ref": "#/$defs/relativePath"
        },
        "region": {
          "$ref": "#/$defs/region"
        },
        "integer_score": {
          "type": "integer"
        },
        "score_reasons": {
          "type": "array",
          "items": {
            "$ref": "#/$defs/scoreReason"
          }
        },
        "symbol": {
          "$ref": "#/$defs/candidateSymbol"
        },
        "candidate_id": {
          "type": "string",
          "pattern": "^candidate:[0-9a-f]{64}$"
        },
        "rank": {
          "type": "integer",
          "minimum": 1
        },
        "role": {
          "enum": [
            "implementation",
            "wrapper",
            "test",
            "fixture",
            "generated",
            "vendor"
          ]
        }
      },
      "allOf": [
        {
          "if": {
            "properties": {
              "kind": {
                "const": "symbol"
              }
            },
            "required": [
              "kind"
            ]
          },
          "then": {
            "required": [
              "symbol"
            ]
          },
          "else": {
            "not": {
              "required": [
                "symbol"
              ]
            }
          }
        }
      ]
    }
  }
}
